,industry,job_title,company_name,location,summary,date_posted
732,services,Courtesy Clerk,"Nugget Market, Inc.",N/A,"Must have a flexible schedule and be able to work any shifts, including weekends and evenings.
Zero premium cost health benefits (even for part-timers).",12 days ago
733,services,Environmental Services Technician,Methodist Hospital Sacramento,N/A,"The incumbent performs cleaning, sanitation and other environmental services and support duties involved in hospital maintenance.",30+ days ago
734,services,Cashier,Raley's Supermarkets,N/A,"A Team Member is a responsible, friendly person who can safely work in a fast-paced environment and provide excellent customer service.
Must be 18 years of age.",30+ days ago
735,services,Retail Clerk,Sprouts Farmers Market,N/A,"Work in several different areas throughout the store to help our guests.
Retrieve carts and wipe down.
Keep the store clean and sanitized.",6 days ago
736,services,Team Member,Chipotle,"Sacramento, CA","Tuition assistance (100% coverage for select degrees or up to $5,250/year).
Free food (yes, really FREE).
Medical, dental, and vision insurance.",6 days ago
737,services,LVN MDS Coordinator (Part-Time),Double Tree Post Acute,"Sacramento, CA 95822 (Meadowview area)","Multiple years’ experience in skilled-nursing care.
1-2 years' experience in an LVN MDS Coordinator role or another leadership/management position in skilled…",Just posted
738,services,Registered Nurse (RN),Applewood Post Acute,"Sacramento, CA","Documents patient care services by charting in patient and department records.
Promotes and restores patients' health by completing the nursing process;…",30+ days ago
739,services,Busser/Host/ Server,Brookfields Restaurant,"Sacramento, CA","Previous experience in customer service, food service, or other related fields.
You will take orders and serve food to patrons at the dining establishment.",3 days ago
740,services,Pieology Team Member,Pieology Pizzeria,N/A,"Provide timely, engaging and friendly guest service.
Team Members are responsible for preparing high quality products and empowered to deliver an exceptional…",25 days ago
741,services,Enrollment Services Representative - Admissions,Carrington College,N/A,"Previous sales or customer service experience preferred.
Provides general customer service to students from enrollment through graduation.",30+ days ago
742,services,Guest Service Associate,European Wax Center,N/A,"Complimentary unlimited brow waxing, as well as discounts on all other services & retail products.
Ability to work a flexible schedule.",30+ days ago
743,services,Warehouse Loader (Part Time),Red Bull Distribution Company,N/A,"The Warehouse Loader position is a responsible for assisting in all warehouse activities including, but not limited to, loading, repackaging, inventory, and…",30+ days ago
744,services,Section Chief/ Staff Services Manager II,California Department of Public Health,N/A,"Ensures staff maintains the database of all devices and associated service providers.
Oversees the surplus services process and reviews surplus reports on a…",4 days ago
745,services,Delivery Driver (Pick-up & Delivery),Rally Factory,N/A,"Drivers enjoy independence on the road and develop a rewarding and enjoyable career incorporating customer service, road safety and driving skills.",10 days ago
746,services,Call Center Representative,TDB,N/A,"Minimum 2 years customer service experience required.
Adhering to privacy rules set forth by the programs we service.
Must be able to type a minimum of 20 WPM.",30+ days ago
747,services,Subway Sandwich Artist - 23343,Subsource,N/A,"Exceptional customer service is a major component of this position.
Understands and adheres to proper food handling, safety and sanitation standards during food…",13 days ago
748,services,Route Delivery Driver,Nestle Waters North America,"Sacramento, CA 94204 (Erikson Industrial Park area)","Pay: $21.25 per hour plus a competitive benefits package with overtime in accordance with state/federal law.
You’ll need a clean driving record.",3 days ago
749,services,Host / Hostess,Red Robin,N/A,"We have enhanced our cleaning and disinfectant standards (Our restaurants are extra squeaky clean!), practice social distancing (every shift, every role), and…",2 days ago
750,services,Restaurant Team Member,Shake Shack,N/A,"Previous hospitality and/or food service experience, a plus – we’ll teach you the rest!
Now Hiring Customer Service-Counter-Cashier-Cook.",4 days ago
751,services,Entry Level Processor (Night Shift),Quest Diagnostics,N/A,"Demonstrates an understanding of the compliance policies related to test ordering, which requires developing ability to research test ordering information on…",9 days ago
752,services,FRONT END DEPARTMENT,Safeway,N/A,"Your job will be to provide our customers with exceptional customer service.
Your job will be to provide the customer with exceptional customer service.",26 days ago
753,services,IT Support Associate II,Amazon.com Services LLC,N/A,"1+ year experience in maintaining laser printers.
1+ year experience with Cisco/networking and either Linux and/or Microsoft.
High School or equivalent diploma.",16 days ago
754,services,Janitor/Custodian,JaniTek,N/A,"Clean and service restrooms with mops and disinfectants.
Availability must be Monday through Friday 6pm-11pm (20 hours weekly).",3 days ago
755,hospitality,Houseman/Valet Attendant,The Delta King Hotel,"Sacramento, CA 95814 (Old Sacramento area)","A job for which people with disabilities are encouraged to apply.
A job for which military experienced candidates are encouraged to apply.",Just posted
756,hospitality,Krispy Kreme - Now Hiring Retail Staff - All Shifts!! 786,WKS Restaurant Group,"Sacramento, CA","Drivers must have a valid Drivers License, proof of insurance, and a good driving record.
Management Positions requires a valid Drivers License.",3 days ago
757,hospitality,Busser/Host/ Server,Brookfields Restaurant,"Sacramento, CA","Serve food and beverages to guests.
Explain to guests about menu items.
Greet and make all guests feel welcome at the restaurant.",3 days ago
758,hospitality,Guest Services Representative,Hilton Garden Inn Sacramento South Natomas,"Sacramento, CA 95833 (Gateway Center area)","May make restaurant, transportation or entertainment reservations for guests; may deposit guests’ valuables in hotel safe or safe-deposit box; may order…",4 days ago
759,hospitality,Night Audit Clerk,"Marriott International, Inc","Sacramento, CA 95814 (Downtown area)",Welcome and acknowledge all guests according to company standards; anticipate and address guests’ service needs; assist individuals with disabilities; thank…,9 days ago
760,hospitality,"Spv, Front Desk, BU (N)",Residence Inn by Marriott Sacramento Downtown at C...,N/A,"Can communicate well with guests.
The safety and security of our guests and associates is of utmost importance to Crescent.
Supervise the Guest Service Agents.",2 days ago
761,hospitality,Stocker - Aisle,Restaurant Depot,N/A,"Ability to communicate with customers, co-workers and supervisors.
Ensures that shelf pricing is correct and reflects the most recent pricing and market…",1 day ago
762,hospitality,Events and Promotions Assistant,Breakthrough Solutions,N/A,"Event Coordinators and Promotional Assistants are responsible for all marketing and event coordination.
Develop & train new team members and advise management…",11 days ago
763,hospitality,Front Desk Agent (Part-time) - Embassy Suites,Embassy Suites by Hilton,N/A,"Greet guests and complete the registration process to include, but not limited to, inputting and retrieving information from the computer, confirmation of guest…",9 days ago
764,hospitality,Guest Service Agent - Kimpton Sawyer Hotel,Kimpton Hotels and Restaurants,N/A,"Conduct pre-assignment of hotel rooms, which includes VIPS, repeat guests, all packages, and any special requests.
Ensure proper credit policies are followed.",5 days ago
765,hospitality,Front of the House Staff,The Boiling Crab,N/A,"The Boiling Crab is now hiring for all positions at its new Miami location! Available positions: Hosts, Servers, Cashiers, and Bus-Runners.. Who We Are: The…",3 days ago
766,hospitality,Front Desk Associate,Atrium Hospitality,N/A,"Valid state driver’s license and adhere to all company guidelines regarding moving violations.
The primary purpose of the Front Desk Associate is to ensure that…",1 day ago
767,hospitality,Burger Patch - Front & Back of House $14.00 + estimated $2-$3/hr tips,Burger Patch,N/A,We are actively taking all recommended and mandated precautions as well as instituting additional safety measures in order to maintain the highest level of…,Today
768,hospitality,Food/Beverage Server,Valley Hi Country Club,N/A,"This is a part time position with full time potential for the right candidate.
Sanitizing, disinfecting, or cleaning procedures in place.",3 days ago
769,hospitality,Guest Service Representative,"Marriott International, Inc",N/A,"Provide guests with room and hotel information, directions, amenities and local interests.
Run daily reports, reviewing to see what needs to be communicated to…",22 days ago
770,hospitality,Krispy Kreme - Now Hiring Retail Staff - All Shifts!! 786,WKS Restaurant Group,"Sacramento, CA","Drivers must have a valid Drivers License, proof of insurance, and a good driving record.
Management Positions requires a valid Drivers License.",3 days ago
771,hospitality,Busser/Host/ Server,Brookfields Restaurant,"Sacramento, CA","Serve food and beverages to guests.
Explain to guests about menu items.
Greet and make all guests feel welcome at the restaurant.",3 days ago
772,hospitality,Food/Beverage Server,Valley Hi Country Club,N/A,"This is a part time position with full time potential for the right candidate.
Sanitizing, disinfecting, or cleaning procedures in place.",3 days ago
773,hospitality,Guest Service Representative,"Marriott International, Inc",N/A,"Provide guests with room and hotel information, directions, amenities and local interests.
Run daily reports, reviewing to see what needs to be communicated to…",22 days ago
774,hospitality,Server (Sacramento),University of Beer,N/A,UNIVERSITY OF BEER (UOB) is a growing CRAFT BEER BAR & RESTAURANT chain looking for fast and hard-working SERVERS to help us deliver incredible food and…,5 days ago
775,hospitality,Busser/Host/ Server,Brookfields Restaurant,N/A,"Serve food and beverages to guests.
Explain to guests about menu items.
Greet and make all guests feel welcome at the restaurant.",3 days ago
776,hospitality,Guest Services Representative,Hilton Garden Inn Sacramento South Natomas,N/A,"May make restaurant, transportation or entertainment reservations for guests; may deposit guests’ valuables in hotel safe or safe-deposit box; may order…",4 days ago
777,hospitality,"HOSPITALITY TEAM MEMBERS – Host, Food Runner, Busser",Mendocino Farms,N/A,"Full-time AND Part-time hours available.
Ability to work a flexible schedule including nights, weekends, and holidays.
Lift and carry up to 35 lbs.",8 days ago
778,hospitality,Front of House Team Member,Fixins Soul Kitchen,N/A,"Fixins is hiring Front of House Team Members to assist with bagging, handing out food to customers, running, and cashiering…",1 day ago
779,hospitality,GUEST SERVICE REPRESENTATIVE,Hilton Garden Inn Sacramento,N/A,"Greet, register, and assign rooms to guests.
Compute bill, collects payment and makes change for guests.
Equipment such as telephone, fax and switchboard.",19 days ago
780,hospitality,Night Audit Clerk,"Marriott International, Inc",N/A,Welcome and acknowledge all guests according to company standards; anticipate and address guests’ service needs; assist individuals with disabilities; thank…,9 days ago
781,hospitality,"Spv, Front Desk, BU (N)","Crescent Hotels & Resorts, LLC",N/A,"Can communicate well with guests.
The safety and security of our guests and associates is of utmost importance to Crescent.
Supervise the Guest Service Agents.",2 days ago
782,hospitality,Night Audit Clerk,"Marriott International, Inc","Sacramento, CA 95814 (Downtown area)",Welcome and acknowledge all guests according to company standards; anticipate and address guests’ service needs; assist individuals with disabilities; thank…,9 days ago
783,hospitality,Guest Services Representative,Hilton Garden Inn Sacramento South Natomas,"Sacramento, CA 95833 (Gateway Center area)","May make restaurant, transportation or entertainment reservations for guests; may deposit guests’ valuables in hotel safe or safe-deposit box; may order…",4 days ago
784,hospitality,Houseman/Valet Attendant,The Delta King Hotel,"Sacramento, CA 95814 (Old Sacramento area)","A job for which people with disabilities are encouraged to apply.
A job for which military experienced candidates are encouraged to apply.",Just posted
785,hospitality,STARBUCKS / JAMBA JUICE DEPARTMENT,Safeway,N/A,"You will assist with cleaning and sanitizing food preparation areas, tools, and equipment.
Maintain a clean and eye appealing department by cleaning all…",26 days ago
786,hospitality,Front Desk Clerk,Elica Health Centers,N/A,"If an Eligibility Worker is not available, checks patient eligibility on the state medical website, calls private insurances and/or Medicare to check patient’s…",18 days ago
787,hospitality,Part Time Concierge - 20 Hours - Fort Sutter Sacramento Branch,Citi,N/A,Ability to use the various marketing tools and digital technology available in the branch to present product offers and financial solutions to existing and…,3 days ago
788,hospitality,Guest Service Agent,Larkspur Landing Sacramento,N/A,"Register and assign guests to hotel rooms.
Secure guests' valuables in hotel safe or safe-deposit boxes, if not available in guest rooms.",12 days ago
789,hospitality,Housekeeper,Fort Sutter Tapestry Sacramento,N/A,Recamarera tiene la responsabilidad de mantener limpias ordenadas y atractivas las habitaciones de los clientes pasillos áreas públicas del hotel limpiando los…,8 days ago
790,hospitality,Room Attendant/Housekeeper - Kimpton Sawyer Hotel,Kimpton Hotels and Restaurants,N/A,"As a Room Attendant with Kimpton, you'll be responsible for cleaning guest rooms and common areas, all the while providing outstanding service to our guests…",3 days ago
791,hospitality,Team Lead-109010,Extended Stay America,N/A,"Provides other relief or back-up duties as needed at the hotel including front desk coverage, housekeeping, and other duties when needed to ensure optimum…",Today
792,hospitality,Beertender,Urban Roots Brewery LP,N/A,"Give warm welcomes and fond farewells to all guests.
Take orders from guests through the point of sale.
Are ready to take on something brand new.",17 days ago
793,hospitality,Part Time Desk Clerk,Hotel Contracting Services Inc,N/A,"Must be available to work from 2:00 pm until 10:00 pm Sundays through Tuesdays, with the potential for shifts on Wednesdays through Fridays and an occasional 10…",24 days ago
794,hospitality,Front Desk PART TIME - IHG Experienced,Staybridge Suites,N/A,"Greets, registers, and assigns rooms to guests.
Quality – Demonstrates accuracy and thoroughness; applies feedback to improve performance; Monitors own work to…",7 days ago
795,hospitality,Revival Runner - Revival,Kimpton Hotels and Restaurants,N/A,"Ensure guests receive all dishes in an efficient, courteous and accurate manner.
Greet and welcome restaurant guests.
Must have CA Food Handler Certification.",2 days ago
796,hospitality,Tasting Room Sales Associates (Customer Service and Sales),Elevation Ten Winey,N/A,"Organizing, cleaning, stocking both front and back of house.
Lead guests through wine tasting flights – educating them about the winery story, wines, and brand.",2 days ago
797,hospitality,Houseman,DoubleTree by Hilton,N/A,"Delivering linen to all floors, emptying housekeeping and exterior trashcans, vacuuming hallways, shampooing carpet, minor room repairs, picking up debris near…",1 day ago
798,hospitality,Stocker - Freezer,Restaurant Depot,N/A,"Ability to communicate with customers, co-workers and supervisors.
Ensures that shelf pricing is correct and reflects the most recent pricing and market…",30+ days ago
799,hospitality,Front Desk Agent,Doubletree Suites Hilton Sacr,N/A,"Ensure logging and delivery of packages mail and messages as needed to guests and meeting rooms.
Must be effective at listening to understanding and clarifying…",30+ days ago
800,hospitality,Front of House Staff needed for Vegan Cafe,Vegan Cafe,N/A,"Cleaning store including restroom, dishes, equipment, and floors, emptying garbage and other various cleaning duties as assigned.
Be flexible as we grow.",2 days ago
801,hospitality,Restaurant Busser and Host,Old Spaghetti Factory,N/A,"Making guests feel welcome and comfortable.
Greet customers warmly and accommodate any special needs our guests may have.
Meals up to 50% off.",2 days ago
802,hospitality,Host/ess,Fixins Soul Kitchen,N/A,"Maintain energy and enthusiasm throughout the shift.
Answer the telephone in a friendly, upbeat manner and with a smile on your face.",1 day ago
803,hospitality,Evening Guest Service Agent/Front Desk,Homewood Suites by Hilton,N/A,"Greets, registers, and assigns rooms to guests.
Quality – Demonstrates accuracy and thoroughness; applies feedback to improve performance; Monitors own work to…",12 days ago
804,hospitality,Server,Fixins Soul Kitchen,N/A,"Provide every Guest with relentless service to ensure we exceed their expectations and provide them with their first, next, and last great experience at Fixins.",1 day ago
805,hospitality,Bar Back (Sacramento),University of Beer,N/A,"Incredible community of co-workers!
Sanitizing, disinfecting, or cleaning procedures in place.
FULL & PART-TIME Positions Available.
Able to lift 85+ lbs.",5 days ago
806,hospitality,Desk Clerk - Hotel Berry,The John Stewart Company,N/A,"Distribute resident mail on daily basis.
Writes end of shift reports and incident reports, writes work orders, enforces project policies in a manner consistent…",30+ days ago
807,hospitality,"barista - Store# 63111, SUNRISE & SUNGARDEN",Starbucks,N/A,Maintains a calm demeanor during periods of high volume or unusual events to keep store operating to standard and to set a positive example for the shift team.,3 days ago
808,hospitality,Front of House Supervisor,Radisson Hotel,N/A,"Ensures that guests’ needs are fulfilled and their stay is as pleasurable as possible.
Sanitizing, disinfecting, or cleaning procedures in place.",10 days ago
809,hospitality,Guest Service Representive,Residence Inn by Marriott Sacramento Cal Expo,N/A,"Greets, registers, suggestively sells rooms, issues room keys, assigns rooms to guests and sets wake up calls in an efficient, warm and friendly manner.",30+ days ago
810,hospitality,Host,BJ's Restaurant and Brewhouse,N/A,"Provide all guests with a salutation.
Use proper BJ’s telephone etiquette to answer and direct calls.
Our extensive menu includes BJ's signature deep dish pizza…",30+ days ago
811,hospitality,Front Desk Agent (Part-Time/Full-Time),Comfort Suites Downtown Sacramento,N/A,"Hotel has a transparent screen between guest and FD agent.
Must be willing to help the team in anyway (pick up a shift, help out a team member, etc.).",13 days ago
812,hospitality,Guest Services Representative/Front Desk - AM SHIFT,La Quinta Sacramento North,N/A,"Ultimately, you will manage guest services and our hotel’s image by answering guests’ requests and making sure our visitors are satisfied.",2 days ago
813,hospitality,COCKTAILER,WOK IN THE PARK LLC,N/A,"Provide guests with prompt and accurate beverage service.
Upsells and delivers high quality drink orders to guests in a timely manner.",30+ days ago
814,hospitality,Tasting Room Bartender,Two Rivers Cider Company,N/A,"Sanitizing, disinfecting, or cleaning procedures in place.
We are requiring all bartenders to wear masks while behind bar and interacting with customers.",9 days ago
815,hospitality,Desk Clerk - Hotel Berry,The John Stewart Company,N/A,"Distribute resident mail on daily basis.
Writes end of shift reports and incident reports, writes work orders, enforces project policies in a manner consistent…",30+ days ago
816,hospitality,"barista - Store# 63111, SUNRISE & SUNGARDEN",Starbucks,N/A,Maintains a calm demeanor during periods of high volume or unusual events to keep store operating to standard and to set a positive example for the shift team.,3 days ago
817,hospitality,Front of House Supervisor,Radisson Hotel,N/A,"Ensures that guests’ needs are fulfilled and their stay is as pleasurable as possible.
Sanitizing, disinfecting, or cleaning procedures in place.",10 days ago
818,hospitality,Guest Service Representive,Residence Inn by Marriott Sacramento Cal Expo,N/A,"Greets, registers, suggestively sells rooms, issues room keys, assigns rooms to guests and sets wake up calls in an efficient, warm and friendly manner.",30+ days ago
819,hospitality,Host,BJ's Restaurant and Brewhouse,N/A,"Provide all guests with a salutation.
Use proper BJ’s telephone etiquette to answer and direct calls.
Our extensive menu includes BJ's signature deep dish pizza…",30+ days ago
820,hospitality,Front Desk Agent (Part-Time/Full-Time),Comfort Suites Downtown Sacramento,N/A,"Hotel has a transparent screen between guest and FD agent.
Must be willing to help the team in anyway (pick up a shift, help out a team member, etc.).",13 days ago
821,hospitality,Guest Services Representative/Front Desk - AM SHIFT,La Quinta Sacramento North,N/A,"Ultimately, you will manage guest services and our hotel’s image by answering guests’ requests and making sure our visitors are satisfied.",2 days ago
822,hospitality,COCKTAILER,WOK IN THE PARK LLC,N/A,"Provide guests with prompt and accurate beverage service.
Upsells and delivers high quality drink orders to guests in a timely manner.",30+ days ago
823,hospitality,Tasting Room Bartender,Two Rivers Cider Company,N/A,"Sanitizing, disinfecting, or cleaning procedures in place.
We are requiring all bartenders to wear masks while behind bar and interacting with customers.",9 days ago
824,hospitality,Server,Yard House,N/A,"Our restaurants have a fast-paced atmosphere, so it is crucial that our Servers take pride in providing attentive, friendly and clean/sanitary service that…",30+ days ago
825,hospitality,Busser,Fixins Soul Kitchen,N/A,"Live by Fixins’ vision and mission in every interaction, every shift.
Provide clean tables quickly, quietly, efficiently, and thoroughly.",1 day ago
826,hospitality,Host,Yard House,N/A,"They're responsible for greeting Guests with genuine hospitality and professionalism, accurately quoting wait times, seating Guests in a clean/ sanitary…",30+ days ago
827,hospitality,Restaurant Manager,Yard House,N/A,"Highly Competitive Salary + Benefits • Achievable Quarterly Bonus Program.
Career Advancement Opportunities • Paid Vacations & Sick Days.",13 days ago
828,hospitality,Host/Hostess,"Texas Roadhouse | Ultra Steak, Inc.",N/A,"Gives a friendly greeting such as ""Hi, welcome to Texas Roadhouse"" and a heartfelt thanks, inviting guests to come back soon.",5 days ago
829,hospitality,Bellperson / Valet / Shuttle Driver (Full-time) - Embassy Suites Sacramento,Hilton,"Sacramento, CA 95814 (Old Sacramento area)","Inspect guest rooms and acquaint guests with these rooms and their features.
Greet arriving and departing guests in a timely, friendly and efficient manner.",22 days ago
830,hospitality,Host/Hostess,"Texas Roadhouse | Ultra Steak, Inc.",N/A,"Gives a friendly greeting such as ""Hi, welcome to Texas Roadhouse"" and a heartfelt thanks, inviting guests to come back soon.",5 days ago
831,hospitality,Bellperson / Valet / Shuttle Driver (Full-time) - Embassy Suites Sacramento,Embassy Suites by Hilton,N/A,"Inspect guest rooms and acquaint guests with these rooms and their features.
Greet arriving and departing guests in a timely, friendly and efficient manner.",22 days ago
832,hospitality,Room Attendant,Wyndham Hotels & Resorts,N/A,"Restock housekeeping cleaning cart for next day's use.
Complete all pre-cleaning duties, including but not limited to, guest supplies, cleaning supplies, and…",30+ days ago
833,hospitality,Vino Volo Market Clerk/Barista,"Taste, Inc. (USA)",N/A,"Engage with guests in a friendly and professional manner, answer any questions they may have, quickly serve them and tender payment.",30+ days ago
834,hospitality,Host,The Cheesecake Factory,N/A,"Discounted Shift Meal + 25% discount when dining as a guest.
From communicating accurate wait times to showing them to their tables, hosts are a critical part…",30+ days ago
835,hospitality,Wait Staff/Server,The Original House of Soul,N/A,"Deep cleaning sanitizing every station after every shift.
Busing, cleaning, and resetting tables.
Sanitizing, disinfecting, or cleaning procedures in place.",19 days ago
836,hospitality,Vino Volo Market Clerk/Barista,Paradies Lagardere,N/A,"Engage with guests in a friendly and professional manner, answer any questions they may have, quickly serve them and tender payment.",30+ days ago
837,hospitality,Restaurant Server,Leisure Care,N/A,The Restaurant Server is responsible for the flow of service from the kitchen to ensure all residents receive their preferences in both food and beverages.,17 days ago
838,hospitality,Front Desk Agent,Westmont Hospitality Group,N/A,"Greet guests and efficiently process registration and assignment of rooms.
Assist guests with request and/or complaints and monitor issues through to resolution…",30+ days ago
839,hospitality,Tasting Room Host,Due Vigne Winery,N/A,"To keep our team and guests safe, we have implemented new Covid-19 cleaning procedures, mandatory mask wearing, extra sanitizing materials, and hand washing…",2 days ago
