,industry,job_title,company_name,location,summary,date_posted
208,education,Contract Teacher,The Teacher Marketplace,N/A,"Looking for all levels of education: Pre-K through University.
Degree in teaching or in a specialized subject with a certificate in education.",30+ days ago
209,education,Enrollment Services Representative,Carrington College,N/A,"As the Enrollment Services Representative, you are responsible for generating student enrollments, as well as handling all phases of the enrollment process.",30+ days ago
210,education,Kumon Math and Reading/Writing Tutor,Kumon Math and Reading Tutoring Center,N/A,"Kumon is an after-school math and reading program that employs a unique learning method designed to help each child master the basics of math and reading, as…",5 days ago
211,education,Contract Teacher,The Teacher Marketplace,N/A,"Looking for all levels of education: Pre-K through University.
Degree in teaching or in a specialized subject with a certificate in education.",30+ days ago
212,education,Enrollment Services Representative,Carrington College,N/A,"As the Enrollment Services Representative, you are responsible for generating student enrollments, as well as handling all phases of the enrollment process.",30+ days ago
213,education,Kumon Math and Reading/Writing Tutor,Kumon Math and Reading Tutoring Center,N/A,"Kumon is an after-school math and reading program that employs a unique learning method designed to help each child master the basics of math and reading, as…",5 days ago
214,education,Training Coordinator,Bergelectric,N/A,The Training Coordinator is responsible for identifying new and current employees that require training based on their position and responsibility level.,26 days ago
215,education,Volunteer Mentor,"Society of St. Vincent de Paul, Sacramento",N/A,"We are looking for mentors from all walks of life.
Being a mentor means offering non-judgemental listening, encouragement, and guidance.",10 days ago
216,education,Teachers at Rancho Cordova KinderCare,KinderCare Learning Centers,"Rancho Cordova, CA (Walnut Wood area)","Create a safe, nurturing environment where children can play and learn.
Support your center’s success by partnering with center staff and leadership to achieve…",5 days ago
217,education,STEM Educator,Numerade,N/A,"Subject Line: Seeking STEM Experts - Flexible/Remote Work *.
Possess or seeking a STEM degree preferred.
You will be assigned a textbook, and tasked to create a…",12 days ago
218,education,Dance Instructor,Arthur Murray Dance Center,"Elk Grove, CA 95758","For all of those selected, we immerse them in a comfort zone altering boot camp (paid training).
When ready, we transition them into full time dance instructors…",3 days ago
219,education,Middle School Teacher,GetSelected.com,N/A,"Have an education degree, in-progress or completed teaching certification, and/or teaching experience.
Seeking Middle School Teachers at multiple partner school…",12 days ago
220,education,Substitute Teacher,St. HOPE Public Schools,N/A,"Substitute Teachers at St. HOPE are held to the highest standards of conduct, dress, and overall professionalism.
Engage and challenge students in learning.",1 day ago
221,education,Adjunct Faculty-Online Campus-Dissertation Committee Member in the Ed.D. Organizational Leadership Program,Brandman University,N/A,"Steeped in academic tradition, Brandman University provides quality education to primarily non-traditional students who demand the same high academic standards…",30+ days ago
222,education,Professor of Lawyering Skills,University of the Pacific,N/A,"The University of the Pacific, McGeorge School of Law invites applications from entry-level and lateral candidates for an ABA 405( c ) compliant lawyering…",16 days ago
223,education,UC Davis School of Education 2020-21 Lecturer Pool,"University of California, Davis",N/A,"Preferred – teaching experience in higher education (including experience as a Teaching Assistant).
Minimum of one year teaching experience in higher education …",30+ days ago
224,education,Wellness Mentor,CSHC - Wellness and Recovery Center- South,N/A,"Providing cultural, education, social, recreational and vocational activities;
The Wellness and Recovery Mentors shall collaborate with staff, probation…",5 days ago
225,education,Instructional Assistant: for children with special needs,"Learning Solutions Kids, Inc.","Sacramento, CA","Status: Part-time or Full-time if available.
Monday- Friday 8:00am-6:00pm for potential full time hours.
Physical Requirements: Bending, stooping, squatting,…",4 days ago
226,education,Adjunct Articulation Officer,Los Rios Community College District,N/A,"The Articulation Officer position is a 60% adjunct counseling position for one year.
The assignment includes coordination activities related to curriculum and…",30+ days ago
227,education,Teachers at Rancho Cordova KinderCare,KinderCare Learning Centers,"Rancho Cordova, CA (Walnut Wood area)","Create a safe, nurturing environment where children can play and learn.
Support your center’s success by partnering with center staff and leadership to achieve…",5 days ago
228,education,STDT SVC MGR 1 (UAP Director),"University of California, Davis",N/A,Participates in standing and ad-hoc committees that provide policy actions or advice affecting undergraduate education.,5 days ago
229,education,Youth Peer Mentor (The Source),Sacramento Children’s Home,N/A,"OVERVIEW: Under the supervision of the Clinical Program Manager, the Youth Peer Mentor (YPM) provides immediate and follow up care and support to current and…",26 days ago
230,education,Library Assistant,California Northstate University,N/A,"Job Classification: part-time, hourly, non-exempt $18.
Reporting Responsibility: Report directly to the Director of University Operations.",30+ days ago
231,education,Cosmetology Instructor,Highlands Community Charter School,N/A,"Must have a CTE Credential or ability to obtain one.
Personal protective equipment provided or required.
Sanitizing, disinfecting, or cleaning procedures in…",3 days ago
232,education,Math Tutor,Options For Youth Public Charter Schools,N/A,"Primary responsibility is to assist teachers in teaching the necessary concepts to students within the designated math units.
Keep the work area neat and clean.",12 days ago
233,education,Intersession Teacher,Options For Youth Public Charter Schools,N/A,"Provides targeted interventions for special education students and English Language Learners.
Educational technology, digital teaching, or online teaching and…",12 days ago
234,education,Avid Tutor (Part Time) - Early College High School.,Fortune School of Education,N/A,AVID students who continue their education in college often return to AVID sites as tutors however this is not required to earn the position.,4 days ago
235,education,Resource Mentor,Consumers Self Help - WRC,N/A,"Providing cultural, education, social, recreational and vocational activities;
This position provides recovery based services which may include but are not…",26 days ago
236,education,Dance Instructor,Arthur Murray Dance Center,"Elk Grove, CA 95758","For all of those selected, we immerse them in a comfort zone altering boot camp (paid training).
When ready, we transition them into full time dance instructors…",3 days ago
237,education,Math and Reading assistant,Kumon Math and Reading Center,N/A,"Seeking math and reading assistants for an after school learning program.
Kumon of Elk Grove/Laguna is part of the world's largest after-school math & reading…",30+ days ago
238,education,Coach/Mentor/Event Specialist,Booster Enterprises,N/A,"Program Specialists - You are the face of the Boosterthon program on school campuses!
You continually display professionalism, intentionality, and positive…",15 days ago
239,education,Infant/Toddler Teacher,Rainbow Daycare Inc.,N/A,"Company Health and Dental Plan eligibility after qualifying period!.
Minimum 15 ECE units with grades of “C” or better.",1 day ago
240,education,Instructional Assistant: for children with special needs,"Learning Solutions Kids, Inc.","Sacramento, CA","Status: Part-time or Full-time if available.
Monday- Friday 8:00am-6:00pm for potential full time hours.
Physical Requirements: Bending, stooping, squatting,…",4 days ago
241,education,School Age Teacher,KinderCare Learning Centers,N/A,"Lead, coach and mentor less experienced teachers in your classroom; model behaviors and provide feedback.
Create and tailor lesson plans each week to support…",5 days ago
242,education,Career Services Coordinator,Gurnick Academy of Medical Arts,N/A,Bachelors Degree or at least two years related experience and/or training; or equivalent combination of education and experience.,8 days ago
243,education,Intersession Spanish Tutor,Options For Youth Public Charter Schools,N/A,The primary responsibility of the Summer Spanish Tutor is to assist teachers in teaching the necessary concepts to students within the designated Spanish units.,12 days ago
244,education,Tenure Track-Faculty - Entrepreneurship,"California State University, Sacramento",N/A,"Job Code 2360-Tenure Track faculty.
Full/Part Time Full Time.
Strategy & Entrepreneurship (S&E) Department, College of Business Administration, https://www.csus…",13 days ago
245,education,Long Term Substitute TK Teacher,Aspire Public Schools,N/A,Long Term…,30+ days ago
246,education,Instructional Assistant,Kadiant Llc,N/A,"High school diploma or completion of general education (GED) certificate.
The Instructional Assistant works as part of the classroom team to motivate students…",15 days ago
247,education,Pre-Six Lecturer 2021-2022,"University of California, Davis",N/A,"PRE-SIX LECTURER POSITIONS FOR 2021-2022.
UC Davis Department of Mathematics.
The Department of Mathematics at the University of California, Davis anticipates…",2 days ago
248,education,Intersession ELA tutor,Options For Youth Public Charter Schools,N/A,The primary goal of this English Language Arts Tutor is to support and carry out the instructional leadership team goals of 100% CAHSEE pass rates and all…,12 days ago
249,education,Elementary Long Term Substitute,Merryhill School,N/A,Demonstrated knowledge of and proficiency with technology and commitment to the unique role it plays in the education arena of the 21st Century.,30+ days ago
250,education,Dance Instructor,Arthur Murray Dance Center,"Elk Grove, CA 95758","For all of those selected, we immerse them in a comfort zone altering boot camp (paid training).
When ready, we transition them into full time dance instructors…",3 days ago
251,education,Early Preschool Teacher,Childtime Learning Centers,N/A,"Coursework or a degree in early childhood education or child development or a CDA.
EARLY PRESCHOOL TEACHER FOR CHILD CARE.
A High School diploma or equivalent.",8 days ago
252,education,Lecturer - Organizational Behavior for Technology Management -2021,"University of California, Davis",N/A,"The Graduate School of Management at the University of California, Davis, seeks part time instructors to teach one or more courses in the area of Management and…",12 days ago
253,education,Assistant Executive Vice Chancellor (EXEC ADVISOR MGR 2),"University of California, Davis",N/A,The AEVC's responsibilities span the entire Davis campus organization by virtue of the incumbent's senior advisor role for the Provost and Executive Vice…,22 days ago
254,education,Tenure Track Faculty - Ethnic Studies/Pan African Studies,"California State University, Sacramento",N/A,"(no more than three pages) • Teaching effectiveness may be demonstrated through Student Evaluations.
Job Code 2360-Tenure Track faculty.",13 days ago
255,education,Driving Instructor,Coastline,N/A,"Training begins with online education, in a virtual classroom environment.
We're looking for both full-time and part-time instructors.",24 days ago
256,education,Preschool Program Director,"Tots Of Love Child Development Center, llc",N/A,"Candidates who are warm, professional, nurturing, responsible, energetic, and dependable are ideal.
The position is available immediately with competitive pay…",14 days ago
257,education,MCAT General Chemistry Instructor,The Princeton Review,N/A,"Either way, our superior training and comprehensive curriculum will give you the skills you need to lead and support students through their test prep.",30+ days ago
258,education,Mental Health Training Coordinator,Sacramento Children’s Home,N/A,"OVERVIEW: Under the direction of the Director of Mental Health, the Mental Health Training Coordinator (MHTC) identifies training needs in identified programs,…",18 days ago
259,education,Natural Sciences,California State University,N/A,"The department has strong ties to campus programs in ethnic studies, Asian American studies, Chicanx-Latinx studies, Native American studies, Pan African…",26 days ago
260,education,Program Lead and Assistant/Associate Professor of Practice for Leadership and Innovation EdD,University of the Pacific,N/A,"Practitioner experience in P/K-20 education.
Demonstrated leadership experience in education-related start-ups (e.g., founding new schools, starting a new…",2 days ago
261,education,Student Finance Advisor,Iec Aai Holdings Inc,N/A,"What We Offer: We are a Certified Employee-Owned Company and our full-time colleagues have a variety of benefits available to them, such as Medical, Dental,…",30+ days ago
262,education,Teachers at Mack Road KinderCare,KinderCare Learning Centers,N/A,"Create a safe, nurturing environment where children can play and learn.
Support your center’s success by partnering with center staff and leadership to achieve…",12 days ago
263,education,Tenure Track Faculty - Geography,"California State University, Sacramento",N/A,"Scholarly interests and experience, particularly in the context of doing research with undergraduate students.
Job Title Tenure Track Faculty - Geography.",13 days ago
264,education,Infant and Toddler Teachers,Arista Preschool,N/A,"A minimum of the 12 Core Early Childhood Education units.
CDA Degree or a Permit.
Clear fingerprints for FBI, DOJ, and child abuse.",16 days ago
265,education,Instructional Aide,Rose Family Creative Empowerment Center,N/A,"The Instructional Aide will provide activities for groups of up to 20 scholars in homework, reading, math, various enrichment and physical activities, nutrition…",30+ days ago
266,education,"OVERVIEW: Under the supervision of the Clinical Program Manager, the Youth Peer Mentor (YPM) provides immediate and follow",Sacramento Children’s Home,N/A,"OVERVIEW: Under the supervision of the Clinical Program Manager, the Youth Peer Mentor (YPM) provides immediate and follow-up care and support youth being…",15 days ago
267,education,Dance Instructor,Arthur Murray Dance Center,"Elk Grove, CA 95758","For all of those selected, we immerse them in a comfort zone altering boot camp (paid training).
When ready, we transition them into full time dance instructors…",3 days ago
268,education,Student Academic Advisor 2-SOM: Department of Public Health Sciences- Davis Campus,"University of California, Davis",N/A,"Experience advising students in higher education, preferably within an undergraduate or graduate program.
Experience with advising methods & strategies, and…",30+ days ago
269,education,Certified BLS CPR Instructor,UCPRA,N/A,"CPR Classes Co., a national training organization, is looking for competent BLS instructors to support our clients by delivering exceptional training…",30+ days ago
270,education,Business/Management,California State University,N/A,"Strategy & Entrepreneurship (S&E) Department, College of Business Administration, https://www.csus.edu/college/business-administration/strategy-entrepreneurship…",30+ days ago
271,education,Student Academic Advisor 2-SOM: Department of Public Health Sciences- Davis Campus,"University of California, Davis",N/A,"Experience advising students in higher education, preferably within an undergraduate or graduate program.
Experience with advising methods & strategies, and…",30+ days ago
272,education,Certified BLS CPR Instructor,UCPRA,N/A,"CPR Classes Co., a national training organization, is looking for competent BLS instructors to support our clients by delivering exceptional training…",30+ days ago
273,education,Business/Management,California State University,N/A,"Strategy & Entrepreneurship (S&E) Department, College of Business Administration, https://www.csus.edu/college/business-administration/strategy-entrepreneurship…",30+ days ago
274,education,Preschool Teacher - Beginner,Merryhill School,"Sacramento, CA 95835 (Village 7 area)",Complies with all state education and licensing standards and maintains validation of credentials for the position (i.e. professional development).,8 days ago
275,education,Montessori & Preschool Teachers,Little Flowers Montessori,"Elk Grove, CA 95758","We are looking for teachers who are creative, energetic, and simply enjoy being with young children.
We provide excellent benefits to full-time employees…",20 days ago
276,education,"Clinical Nurse Educator in Sacramento, CA",Curative Inc.,"Sacramento, CA","Participate in training/retraining and continuing education programs as necessary.
The Curative Vaccines Program is rolling out the distribution of COVID-19…",6 days ago
277,education,Safe Life Teaching Assistant,Safe Life Project,N/A,"Safe Life Teaching Assistants work in a variety of community settings with individuals, who have developmental disabilities and/or autism, to deliver personal…",30+ days ago
278,education,Substitute Teacher,Growing Brilliant Preschool,"Sacramento, CA 95835 (Village 7 area)","The school features organic gardens, many school animals (and chickens, goats etc.), and new or renovated facilities.
MUST have 12 ECE units.",12 days ago
279,education,Theater Scorer,Pearson,N/A,"The Evaluation Systems group of Pearson offers dynamic teacher licensing and performance assessment solutions.
Starting rate of $15.49 per hour.",22 days ago
280,education,Part time Substitute Teacher,KinderCare Learning Centers,N/A,"Create a safe, nurturing environment where children can play and learn.
Support your center’s success by partnering with center staff and leadership to achieve…",1 day ago
281,education,Toddler Assistant Guide (Teacher),Guidepost Montessori at Folsom,N/A,"Familiarity with the Montessori approach to education is preferred, but not required.
This position is a flexible full-time or part-time role with great…",12 days ago
282,education,Early Preschool Lead Teacher,Childtime Learning Centers,N/A,"The Lead Teacher promotes the social, physical, and intellectual growth of the children under his/her care and works with the school’s staff to create an…",1 day ago
283,education,Dance Instructor,Arthur Murray Dance Center,"Elk Grove, CA 95758","For all of those selected, we immerse them in a comfort zone altering boot camp (paid training).
When ready, we transition them into full time dance instructors…",3 days ago
284,education,BAR Course Administrator,Kaplan,N/A,"Ability to effectively utilize technology including mobile and desktop applications.
Effective communication and reporting to off-site supervisors.",30+ days ago
285,education,Preschool Teacher,The Lil' School,"Citrus Heights, CA 95610 (Birdcage Heights area)","Lil’ School is looking for YOU!.
Full-time & Part-time shifts available.
Must have 12 units ECE, and pursuing more is a huge plus!",18 days ago
286,education,Instructor,Meissner Sewing & Vacuum Centers,N/A,Machine instruction educators are responsible for teaching New Owner Guide Classes for products sold in our store; assisting with special events and developing…,30+ days ago
287,education,Substitute Elementary School Teacher,The Peregrine Project,N/A,"Peregrine School is a nonprofit independent school whose mission is to educate creative critical thinkers.
Peregrine School serves children ages 18 months to.",12 days ago
288,education,Brand Educator - Central California and Surrounding Areas,MKTG,N/A,"Candidates should be available to work events during Thursdays - Saturdays between 4pm - 12am.
Events are typically 2-4 hours in length.",30+ days ago
289,education,Adjunct Agriculture Instructor,Yuba Community College District,N/A,"Develop and deliver instructional lectures for Agriculture courses up to 10 hours/week.
Organize and teach all levels of Agriculture classes.",30+ days ago
290,education,Preschool Teacher,The Lil' School,"Citrus Heights, CA 95610 (Birdcage Heights area)","Lil’ School is looking for YOU!.
Full-time & Part-time shifts available.
Must have 12 units ECE, and pursuing more is a huge plus!",18 days ago
291,education,Rehabilitation Mentor (Service Coordinator),Consumers Self Help Center - Wellness & Recovery C...,N/A,"Helping Members access cultural, education, social, recreational and vocational activities;
Mentors work collaboratively with individuals served in developing…",15 days ago
292,education,Student Assistant - Special Education Division Support,"University Enterprises, Inc.",N/A,"The Department of General Services is currently seeking to hire a student assistant (SA).
The student will work Under the supervision of the Staff Services…",9 days ago
293,education,Temporary Lecturer,"University of California, Davis",N/A,"Description: The School of Veterinary Medicine, Department of Population Health and Reproduction, invites applications for a temporary lecturer position (title…",18 days ago
294,education,Chemistry Lecturer 2021-2022,"University of California, Davis",N/A,"Lecturer position in the Department of Chemistry.
Duties will include teaching in General Chemistry and/or Organic Chemistry lecture courses and labs.",18 days ago
295,education,Unit 18 Lecturer for FST298 – Spring 2021,"University of California, Davis",N/A,Qualified candidates will have a Master’s Degree in food science or a related field and expertise Design Thinking.,3 days ago
296,education,Dance Instructor,Arthur Murray Dance Center,"Elk Grove, CA 95758","For all of those selected, we immerse them in a comfort zone altering boot camp (paid training).
When ready, we transition them into full time dance instructors…",3 days ago
297,education,Full-Time Infant Assistant Guide (Teacher),Guidepost Montessori at Folsom,N/A,"Familiarity with the Montessori approach to education is preferred, but not required.
This position is a flexible full-time role that allows you to get your…",12 days ago
298,education,Reading Tutor/Teacher,Wyzant,N/A,"Set your own hours while you help students learn the subjects you love to teach.
Set your own rate (most tutors charge between $30-60/hour).",4 days ago
299,education,"Test Administrator - Sacramento North, CA",Pearson,N/A,Test centers may need to limit workstation availability to ensure that a safe distance can be maintained between candidates.,8 days ago
300,education,Multi Subject Teacher / Substitute,City of Sacramento Youth Division,N/A,"Sac CLASS was created to address the enormous negative impact of COVID-19 related learning loss, particularly for vulnerable students.",30+ days ago
301,teaching,Tutor in Sacramento – All Subjects Available,Grade Potential Tutoring,"Sacramento, CA",Sacramento families are in immediate need of part-time tutors for all subjects and grade levels.,30+ days ago
302,teaching,Elementary Teachers,Capital Christian Center Church and School,N/A,"Capital Christian Center is not only a great place to worship, grow, serve and learn, it is also a great place to work. We are looking for friendly, humble…",2 days ago
303,teaching,Middle School Mathematics Teacher,Brookfield School,"Sacramento, CA (Greenhaven area)",Top-rated Sacramento K-8 private school is seeking experienced mathematics teachers for small classes of accelerated middle school students.,17 days ago
304,teaching,Coach/ Teaching Assistant - Davis,Sports For Learning,"Davis, CA 95616 (Old Davis North area)","We support in classrooms with virtual lessons, on the field with getting active and through our distance learning platform.
Pay: *$16.50 per hour.",15 days ago
305,teaching,In-Home Spanish Fluent 1st Grade Tutor - Sacramento,Grade Potential Tutoring,"Sacramento, CA 95822 (Meadowview area)","I have an immediate need for an in-home Spanish fluent 1st grade tutor in Sacramento.
Student is in the 1st grade at Bowling Green Chacon Language and Science…",8 days ago
306,teaching,2020-2021 High School Teaching Assistant,St. HOPE Public Schools,N/A,"Valid California substitute or teaching credential.
Copy of valid California substitute or teaching credential.
Supervise locker rooms during PE transitions.",1 day ago
307,teaching,Montessori Assistant Teacher Infant Classroom,Bergamo Montessori School,"Sacramento, CA 95831 (Pocket area)","Observing children and providing input to the teacher.
Helping support children's independent activity.
Keeping children safe with general supervision, conflict…",11 days ago
308,teaching,"Teacher, Student Support",Capitol Collegiate Academy,"Sacramento, CA 95832 (Meadowview area)","Employ various teaching techniques and methods to enable students to meet their IEP goals.
Minimum Education Level: Must have a Bachelor’s degree and a valid…",30+ days ago
309,teaching,2020-2021 Middle School Teaching Assistant,St. HOPE Public Schools,N/A,"Valid California substitute or teaching credential.
Copy of valid California substitute or teaching credential.
Supervise locker rooms during PE transitions.",1 day ago
310,teaching,Online A+ Tutor,Tutor.com,United States,"Job Types: Part-time, Contract.
Job Types: Part-time, Contract.",30+ days ago
311,teaching,Substitute Teacher K-12,The Education Team,"Sacramento, CA","We offer competitive rates and flexible scheduling!
Day-to-day & long-term assignments available.
Bachelor's Degree & CBEST or CSET required.",10 days ago
