,industry,job_title,company_name,location,summary,date_posted
416,teaching,Assistant / Associate Professor of Biotechnology and Neurobiology,California Northstate University,N/A,"Develop an effective teaching style informed by best practices in education literature.
Demonstrated ability to develop innovative teaching strategies, and…",30+ days ago
417,teaching,Secondary English/ELA Teacher,GetSelected.com,N/A,"Have an education degree, in-progress or completed teaching certification, and/or teaching experience.
Seeking Secondary English/ELA Teachers at multiple…",12 days ago
418,teaching,Agriculture Adjunct Assistant Professor,Los Rios Community College District,N/A,"The Los Rios Community College District is seeking a pool of qualified applicants for possible temporary part-time teaching assignments.
Total Hrs per Week/Day.",30+ days ago
419,teaching,Preschool Teacher for Infant/Toddler,Spring Education Group,N/A,"Engaging, creative and full of sparkle are a few words that describe our preschool teaching professionals.
You like being creative within the framework of the…",17 days ago
420,teaching,Preschool Teacher,Bruceville KinderCare,N/A,"As a Teacher you will have the freedom to act silly, create adventures, and teach children lifelong lessons that go beyond the classroom.",18 days ago
421,teaching,Preschool Teacher Assistant,Cadence Education,N/A,"High school diploma or equivalent.
Must be at least 18 years old.
Must meet all state preschool teacher assistant requirements.",15 days ago
422,teaching,Teacher - School Age Program,Penny Valley Child Care Inc. Ready Set Go Children...,N/A,"General cleaning of classroom and common areas, plan activities, and physically able to play games outside with the children.
Assisting other staff when needed.",30+ days ago
423,teaching,Preschool Teacher-Garden Connection,Nature's Lab School,N/A,"This position is responsible for the creation of hands-on, experiential activities for our young students around a garden-based curriculum, the daily operations…",21 days ago
424,teaching,Preschool Teacher,St. Mary School,N/A,"All applicants will be at least 18 years of age, have completed at least 12 core ECE units, have at least 6 months of experience in a licensed child care center…",30+ days ago
425,teaching,Assistant Professor (Clinical X Series) - Endourology,"University of California, Davis",N/A,The candidate must meet these basic qualifications: possess a Medical Degree; completion of an approved fellowship in Endourology on or before the start of the…,22 days ago
426,teaching,Teachers at Vintage KinderCare,KinderCare Learning Centers,"Sacramento, CA","Create a safe, nurturing environment where children can play and learn.
Support your center’s success by partnering with center staff and leadership to achieve…",12 days ago
427,teaching,Tenure Track Faculty - Audiology,"California State University, Sacramento",N/A,"For “Portfolio” provide documentation of any applicable research experience as a document.
Job Title Tenure Track Faculty - Audiology.
Full/Part Time Full Time.",13 days ago
428,teaching,Preschool Teacher,Smallville Preschool,N/A,"Using a variety of teaching methods, including artistic expression, educational play, and storytelling, you will teach children to identify shapes, colors,…",3 days ago
429,teaching,Preschool Teacher - Toddlers,Merryhill School,"Davis, CA 95618 (Downtown Core area)","Their curiosity, questioning, and zest for life inspire our passionate educators every day.
As a preschool teacher you’ll help preschoolers develop their…",23 days ago
430,teaching,Department of Political Science - International Relations,"University of California, Davis",N/A,"The Department of Political Science at the University of California, Davis invites applications for a tenure-track position at the Assistant Professor level in…",30+ days ago
431,teaching,Accounting Adjunct Assistant Professor,Los Rios Community College District,N/A,"The Los Rios Community College District is seeking a pool of qualified applicants for possible temporary part-time teaching assignments.
Total Hrs per Week/Day.",30+ days ago
432,teaching,Preschool Teacher - Infants,Merryhill School,"Sacramento, CA 95833 (South Natomas area)","Their curiosity, questioning, and zest for life inspire our passionate educators every day.
As a preschool teacher you’ll help preschoolers develop their…",30+ days ago
433,teaching,Preschool Teacher,Stepping Stones School at River Life,N/A,There is structured learning time as well as child guided playtime where teachers continue to teach learning objectives through play.*.,30+ days ago
434,teaching,Assistant / Associate Professor of Biotechnology and Neurobiology,California Northstate University,N/A,"Develop an effective teaching style informed by best practices in education literature.
Demonstrated ability to develop innovative teaching strategies, and…",30+ days ago
435,teaching,Secondary English/ELA Teacher,GetSelected.com,N/A,"Have an education degree, in-progress or completed teaching certification, and/or teaching experience.
Seeking Secondary English/ELA Teachers at multiple…",12 days ago
436,teaching,Preschool Teacher for Infant/Toddler (FT),Spring Education Group,N/A,"As a preschool teacher, you’ll help preschoolers develop their problem-solving skills, guide them in both structured learning and playtime, and prepare them…",2 days ago
437,teaching,K-12 Academic Tutor and Mentor | Full-time,City Year,"Sacramento, CA","Diverse teams of City Year AmeriCorps members provide support to students, classrooms and the whole school, helping to ensure that students in systemically…",30+ days ago
438,teaching,Lecturer - Department of Political Science 2020-21,"University of California, Davis",N/A,"The Department seeks applicants with demonstrated research and teaching expertise.
Availability of this position depends upon final administrative approval and…",30+ days ago
439,teaching,Two's Teacher,Childtime Learning Centers,N/A,"Through our play based curriculum, our affectionate and loving staff ensures that our children are imparted with the knowledge to succeed.",8 days ago
440,teaching,Academic Clinician in Pain Medicine (1),"University of California, Davis",N/A,"Experience in teaching medical students, residents, and fellows as well as experience caring for patients with acute and chronic pain, patients with substantial…",30+ days ago
441,teaching,Lecturers in Earth and Planetary Sciences 2020-2021,"University of California, Davis",N/A,"Evidence of teaching excellence or potential for excellence.
Applicants must possess a Ph.D. in geology or a related field and have prior teaching experience at…",30+ days ago
442,teaching,School Age Program - Associate Teacher,Continuing Development Incorporated,N/A,"6-12 months of experience in a group care environment where care/teaching was provided for a consistent age group preferred.
Teaching staff may be required to:",17 days ago
443,teaching,Infant/Toddler Teacher,Discovery Tree Schools,N/A,"A minimum of the 12 Core Early Childhood Education units.
CDA Degree or a Permit.
Clear fingerprints for FBI, DOJ, and child abuse.",5 days ago
444,teaching,2020-21 Science and Technology Studies Temporary Lecturers,"University of California, Davis",N/A,"Candidate must be eligible to work in USA.
Salary: Commensurate with training and experience.",30+ days ago
445,teaching,Daycare Teacher,KW Preschool and Childcare,"Sacramento, CA 95822 (Freeport Manor area)","We are a private, state-funded, toddler and preschool program serving children from 12 months of age through 5 years old.
Love and respect for children.",30+ days ago
446,teaching,Nursing (Registered Nurse - RN) Assistant Professor (Pediatric Focus),Los Rios Community College District,N/A,Completion of at least one year’s experience teaching courses related to registered nursing or completion of a post-baccalaureate course which includes practice…,Today
447,teaching,Computer Science Lecturer Positions 2020-2021,"University of California, Davis",N/A,"Previous teaching experience and evidence of teaching excellence or potential for excellence is preferred.
The Department of Computer Science at the University…",30+ days ago
448,teaching,Aviation Adjunct Assistant Professor,Los Rios Community College District,N/A,The Los Rios Community College District is seeking a pool of qualified applicants for possible temporary part-time faculty teaching assignments.,30+ days ago
449,teaching,Infant and Toddler Teacher,Ready Set Go Children's Center,N/A,"Routine care of Infants and Toddlers.
Acute Supervision, Teaching Developmental Skills, Structured Organization and Classroom Management, General Cleaning of…",15 days ago
450,teaching,Clinical Regional Coordinator (Evergreen),University of the Pacific,N/A,"Faculty members’ activities and accomplishments in the areas of teaching, scholarship, and service are evaluated yearly by the Program Director, with these…",23 days ago
451,construction,Construction Laborer / Excavator operator,"Express Sewer & Drain, Inc.","Rancho Cordova, CA 95742 (Rio del Oro area)","Government jobs as well as private construction jobs.
Looking for a full-time construction laborer/operator in the Rancho Cordova, CA area, most work prevailing…",4 days ago
452,construction,Construction Laborer,Serrao Construction LLC,"Sacramento, CA 95826","Work is on job sites (framing, concrete, finishes, windows, doors, etc.).
As well as in the woodshop (cabinetry, furniture, steel, concrete).",5 days ago
453,construction,Construction Project Associate,"Diamond D Construction, Inc.","Sacramento, CA","Providing diversified construction services in the greater Sacramento area.
\* Maintain and distribute project plans and construction documents.",1 day ago
454,construction,Project Engineer Commercial Construction,Buzz Oates Construction,"Sacramento, CA 95814 (Downtown area)",Exhibit a general understanding of commercial and industrial construction methods and a strong desire to learn and grow in areas not yet very experienced in.,3 days ago
455,construction,Construction Laborer (Underground Utilities),"LASAR Underground Construction, Inc","Sacramento, CA","Laborers needed with experience in concrete, digging and trenching around sensitive underground utilities such as Power, Gas and Cable.",9 days ago
456,construction,General Labor - Operations (FT/Days),PepsiCo,N/A,"Position responsibilities may include general housekeeping (e.g., sanitation, yard cleaning, scrubbing, changing lights, etc.).
High School Diploma or GED.",1 day ago
457,construction,"Construction Safety Engineer, Richmond",C Overaa & Co,"Sacramento, CA","Management position that manages risk associated with construction projects.
Reports To: Corporate Safety Director *.
Demonstrate leadership at all levels.",30+ days ago
458,construction,Technical Assistant,Pro Energy Services Group LLC,"Sacramento, CA","Electric transmission or distribution construction industry experience highly desired.
Reviews jobs for constructability and missing construction material in…",1 day ago
459,construction,General Labor,Advanced Restoration Plus Inc,"Sacramento, CA","We are seeking motivated workers to start ASAP on a full-time basis.
That has a clean DMV record.
Must be able to pass a background check….",23 days ago
460,construction,Assistant Construction Project Manager,St. Anton Communities,"Sacramento, CA 95811 (Boulevard Park area)","Knowledge of basic construction principles.
We currently have multiple projects under construction.
Pre-tax Healthcare and Dependent Care flexible spending…",30+ days ago
461,construction,Structural Steel Field Welders/ Erectors and Fitters,"Lancaster Burns Construction, Inc.","Sacramento, CA","Ability to work on out of town projects.
Read tape measure/Rollout tools.
Ability to read weld symbols.
Ability to install bar joist/girders/steel members.",1 day ago
462,construction,Electrican Apprentice,CWT Services,"Sacramento, CA 95826","Must Have Solid Troubleshooting skills, be able to Diagnose problems, not just replace parts.
Be versed in bending and Installing conduit, MC cable, pulling…",30+ days ago
463,construction,Construction Laborer,MasTec Utility Services,N/A,"As a Construction Laborer, you will support all phases of utility construction for various types of telecom projects.",30+ days ago
464,construction,Aerial Construction Worker,Hylan West,N/A,"Primary job duties will be aerial construction and ground person assistance.
Hylan West’s expertise includes underground construction, specializing in all…",30+ days ago
465,construction,Construction Laborer,McCarthy,N/A,"McCarthy is currently accepting applications for Union Laborers with experience on large construction jobsites.
Load/unload trucks and haul/hoist materials.",30+ days ago
466,construction,Construction Laborer,Serrao Construction LLC,"Sacramento, CA 95826","Work is on job sites (framing, concrete, finishes, windows, doors, etc.).
As well as in the woodshop (cabinetry, furniture, steel, concrete).",5 days ago
467,construction,Project Engineer Commercial Construction,Buzz Oates Construction,"Sacramento, CA 95814 (Downtown area)",Exhibit a general understanding of commercial and industrial construction methods and a strong desire to learn and grow in areas not yet very experienced in.,3 days ago
468,construction,Assistant Construction Project Manager,St. Anton Communities,"Sacramento, CA 95811 (Boulevard Park area)","Knowledge of basic construction principles.
We currently have multiple projects under construction.
Pre-tax Healthcare and Dependent Care flexible spending…",30+ days ago
469,construction,Restoration Project Manager,West Coast Fire & Water,"Sacramento, CA","Knowledge about construction is a plus, but not required.
We have both entry level positions as well as those with experience in the restoration industry.",7 days ago
470,construction,Project Manager/Inside Sales (One Year Construction Sales Highly Preferred),Capital Flow,"Sacramento, CA 95828",Capital Flow is seeking a highly motivated individual to fill an immediate position as a Project Manager/Inside Sales Representative.,8 days ago
471,construction,"Construction Safety Engineer, Richmond",C Overaa & Co,"Sacramento, CA","Management position that manages risk associated with construction projects.
Reports To: Corporate Safety Director *.
Demonstrate leadership at all levels.",30+ days ago
472,construction,Glass and Screen Fabricator,Southgate Glass,"Carmichael, CA 95608","Job duties will include: fabrication work (building screens, cutting glass, assembling IG units etc.), organizing and keeping the shop and showroom clean.",19 days ago
473,construction,Construction Laborer,Installed Building Products,N/A,"Experience in the construction industry.
Loading and logging materials onto a truck.
Erect scaffolding or ladders to height needed.
High School diploma or GED.",23 days ago
474,construction,"Construction Project Manager/Superintendent- Heavy Hydro, Fisheries, Hydro",LPA,N/A,"Welcome to LinkPointe Advisors, LLC. Our laser focus is finding and recruiting the right candidate for your most urgent talent needs…",4 days ago
475,construction,Construction Laborer (Underground Utilities),"LASAR Underground Construction, Inc",N/A,"Laborers needed with experience in concrete, digging and trenching around sensitive underground utilities such as Power, Gas and Cable.",9 days ago
476,construction,Structural Steel Field Welders/ Erectors and Fitters,"Lancaster Burns Construction, Inc.",N/A,"Ability to work on out of town projects.
Read tape measure/Rollout tools.
Ability to read weld symbols.
Ability to install bar joist/girders/steel members.",1 day ago
477,construction,Wood Worker Trainee,Balanced Body Inc.,N/A,"Experience in a wood shop is desirable, but we will train motivated non-experienced candidates;
Able to multi-task and cross-train;
401(k) plan + Match!",1 day ago
478,construction,Landscape Construction Laborer,Brightview,N/A,"Medical, dental, and vision insurance.
Using hand and/or power tools or equipment to perform a wide range of landscape and irrigation duties.",29 days ago
479,construction,Union - Craft Worker,Myers & Sons Construction,N/A,"Overview: Myers & Sons Construciton, LP is always looking for hard working and dynamic union craft workers to join our team. If you are part of one of the…",30+ days ago
480,construction,Technical Assistant,Pro Energy Services Group LLC,N/A,"Electric transmission or distribution construction industry experience highly desired.
Reviews jobs for constructability and missing construction material in…",1 day ago
481,construction,Landscape Construction Laborer,Petretti Landscape & Custom Pools,N/A,Physically able to handle the work load of a construction laborer and have full range of mobility in upper and lower body.,2 days ago
482,construction,General Labor,Advanced Restoration Plus Inc,N/A,"We are seeking motivated workers to start ASAP on a full-time basis.
That has a clean DMV record.
Must be able to pass a background check….",23 days ago
483,construction,Construction Project Associate,"Diamond D Construction, Inc.","Sacramento, CA","Providing diversified construction services in the greater Sacramento area.
\* Maintain and distribute project plans and construction documents.",1 day ago
484,construction,Construction Laborer / Excavator operator,"Express Sewer & Drain, Inc.","Rancho Cordova, CA 95742 (Rio del Oro area)","Government jobs as well as private construction jobs.
Looking for a full-time construction laborer/operator in the Rancho Cordova, CA area, most work prevailing…",4 days ago
485,construction,"Paver Operator, Raker, Laborers, Equipment Operator",BLACK STAR PAVEMENT MAINTENANCE,"Sacramento, CA 95828 (Depot Park area)","High school or equivalent (Preferred).
Commercial Driving: 1 year (Preferred).
Open to applicants under 18 years old, provided it is legally allowed for the job…",17 days ago
486,construction,General Labor Construction,Pallet Management Group,N/A,"Specific vision abilities required by this job include close vision, distance vision, peripheral vision and depth perception.",1 day ago
487,construction,Construction Coordinator,"Production Framing, Inc.",N/A,Large residential framing contractor looking for a Construction Coordinator with knowledge in the construction industry and/or production scheduling to assist…,8 days ago
488,construction,Ready Mix Drivers Wanted,Elite Ready Mix,N/A,"We will also train drivers with no prior experience.
FULL PAID MEDICAL (you pay nothing for coverage).
401k (company contributes up to 4% On a dollar for dollar…",30+ days ago
489,construction,Construction General Labor,Symbia Logistics,N/A,"Some experience in construction and/or related field.
The refurbishing of damaged pallets that weighs 75 to 85 lbs.
Ability to operate electrical power tools.",8 days ago
490,construction,Estimator,"Lupton Excavation, Inc.","Sacramento, CA 95828","Having prior knowledge of underground construction and/or utility installation is preferable.
Underground Utility Design & Installation Company seeking to fill…",30+ days ago
491,construction,Demolition Laborer,West Coast Removal,N/A,"Assist project managers and machine operators in construction projects.
Knowledge of basic construction/demolition principles and methods.",30+ days ago
492,construction,Laborer,Cornerstone Building Brands,N/A,"Production Operator - Ply Gem Windows - $15.00 per hour - $500 Bonus.
Production workers must be able to understand instructions whether they are written or…",4 days ago
493,construction,Underground Utility Laborer,"Marticus Electric, Inc.",N/A,"Valid Clean California Drivers License.
Experience preferred, but not mandatory.
Construction Experience: 1 year (Preferred).",2 days ago
494,construction,Assistant Construction Superintendent,"Cutting Edge Modular, Inc.","Sacramento, CA","3+ years of building trades experience REQUIRED..
Framing, windows, doors, shear, siding, plumbing, electrical, HVAC, roofing, trim, finish ?.",30+ days ago
495,construction,Concrete Labor,WinSol Groundworks,N/A,"Bores holes in timber, masonry or concrete walls, using a power drill.
Dissembles parts by hand or by woodworking and metalworking machines.",24 days ago
496,construction,Wood Shop Worker - Trainee,Balanced Body Inc,N/A,"Experience in a wood shop is desirable, but we will train motivated non-experienced candidates;
Able to multi-task and cross-train;
401(k) plan + Match!",30+ days ago
497,construction,Cable Splicer/Electrician - Advanced Apprentice,Sacramento Municipal Utility District,N/A,The SMUD Downtown Network Cable Splicer group is looking to fill 2 permanent vacancies at the Journey or Advanced Apprentice levels.,3 days ago
498,construction,Construction Builder,Symbia Logistics,N/A,"Some experience in construction and/or related field.
The repairing of damaged pallets that weighs 75 to 85 lbs. using speed, accuracy, and detail that meet…",8 days ago
499,construction,Carpenter Helper,Deome Builders,N/A,All of our worksites are residential exterior projects and crew size is limited to 3 crew members or less so distancing is easily obtained while on site.,18 days ago
500,construction,Construction Builder,Symbia Logistics,N/A,"Some experience in construction and/or related field.
The repairing of damaged pallets that weighs 75 to 85 lbs. using speed, accuracy, and detail that meet…",8 days ago
501,construction,Carpenter Helper,Deome Builders,N/A,All of our worksites are residential exterior projects and crew size is limited to 3 crew members or less so distancing is easily obtained while on site.,18 days ago
502,construction,Apprentice House Painter,VIP-Painting,N/A,"Seeking: *Candidate will have a basic working knowledge and basic experience of interior and exterior house painting; have own hand tools, vehicle and driver's…",12 days ago
503,construction,Estimator,"Lupton Excavation, Inc.","Sacramento, CA 95828","Having prior knowledge of underground construction and/or utility installation is preferable.
Underground Utility Design & Installation Company seeking to fill…",30+ days ago
504,construction,Plumber Apprentice/Helper,"Jeff's Plumbing, Inc",N/A,"We are looking for plumber helpers who have some skills in plumbing with use of all types of materials, and experience working on commercial and residential…",Today
505,construction,Front End Loader Operator,Copart,N/A,"The Loader Operator will be responsible for moving and loading vehicles with a company provided front end loader or fork lift.
HS diploma or GED preferred.",30+ days ago
506,construction,Blender Laborer,VSS Emultech,N/A,"The ideal candidate will be a safe, hardworking, team-oriented person who is ok with working outdoors on road construction crews and some travel.",15 days ago
507,construction,Construction/Special Inspector,United Engineering Resources,N/A,"Ability to properly interpret construction documents, and prepare well-written and concise reports capturing all necessary elements.",30+ days ago
508,construction,Class A CDL Driver/Construction Laborer,SEFNCO Communications,N/A,"As a Class A CDL Construction Laborer, you will support all phases of utility construction for various types of telecom projects.",30+ days ago
509,construction,Assistant Construction Superintendent,"Cutting Edge Modular, Inc.","Sacramento, CA","3+ years of building trades experience REQUIRED..
Framing, windows, doors, shear, siding, plumbing, electrical, HVAC, roofing, trim, finish ?.",30+ days ago
510,construction,APPRENTICE CARPENTER,MAK Design Build,N/A,Apprentice Carpenters will be individuals who are looking to grow their experience in carpentry through on the job training and mentorship.,30+ days ago
511,construction,Hiring Now for Landscape Construction Laborer!,PACIFIC LANDSCAPES,N/A,"Our office is based in Elk Grove CA, serving the greater Sacramento Area.
Valid CA Driver’s License.
Must be on time to work.
Be able to follow directions.",3 days ago
512,construction,Laborer - Groundsman,Trip Hazard,N/A,"As a Groundsman you will be responsible for cleaning, clearing and preparing construction sites for concrete work to be completed.",30+ days ago
513,construction,Sprinkler Apprentice,Johnson Controls,N/A,"Must be able to work alternative shifts or weekends to meet customer and/or job requirements.
Assist Journey persons in the installation of wet, dry, pre-action…",30+ days ago
514,construction,Construction Inspector,Murraysmith,N/A,"Experience in construction inspection or management.
Perform all other daily construction inspection duties.
Must be able to flourish in a team dynamic.",30+ days ago
515,construction,Construction Inspector,Murraysmith,N/A,"Experience in construction inspection or management.
Perform all other daily construction inspection duties.
Must be able to flourish in a team dynamic.",30+ days ago
516,construction,Project Controls Scheduling Engineer,Smarthire,N/A,"This role will be primarily remote, with occasional travel to the Sacramento site location.
This strategic role works directly with clients and is a key team…",17 days ago
517,construction,Pest Control Technician with Construction Experience,PRO ACTIVE PEST CONTROL,N/A,"Must have some experience with power tools and basic construction work.
The position will be specifically to do RODENT / BIRD EXCLUSION services on homes.",8 days ago
518,construction,Residential Home Inspector,United Property Inspectors,N/A,"Ability to work in high temperature environments (summer) and low temperature and wet environments (winter), outside work is required no matter what type of…",3 days ago
519,construction,Utility Pole Inspection Foreman,Osmose Utilities Services,N/A,"Hire, train, and supervise a field crew of 1-5 people.
Maintain all tools, vehicles, and equipment.
Achieve expected safety, quality, and production goals.",30+ days ago
